image_URL;image_ID;original_caption;UND_some;UND_locative;UND_demonstrative;UND_pronoun;UND_person;UND_full
./coco-images/images/COCO_train2014_000000330652.jpg;330652;Two children lying on the booth seats of a restaurant.;Some children lying on the booth seats of a restaurant.;Two children lying there.;NA;NA;Two people lying on the booth seats of a restaurant.;They are doing something here.
./coco-images/images/COCO_train2014_000000184930.jpg;184930;a man holding two very large teddy bears;a man holding some very large teddy bears;NA;a man holding that;NA;a person holding two very large teddy bears;They are doing something here.
./coco-images/images/COCO_train2014_000000196545.jpg;196545;The woman is showing the toppings on her hotdog.;NA;NA;The woman is showing that.;They are showing the toppings on their hotdog.;The person is showing the toppings on their hotdog.;They are doing something here.
./coco-images/images/COCO_train2014_000000198072.jpg;198072;A man in a helmet observes his reflection in a motorcycle side mirror.;NA;A man in a helmet observes his reflection there.;A man in a helmet observes this in a motorcycle side mirror.;NA;A person in a helmet observes their reflection in a motorcycle side mirror.;They are doing something here.
./coco-images/images/COCO_train2014_000000439463.jpg;439463;A woman with a wooden pizza board is near a huge oven.;NA;A woman with a wooden pizza board is there.;A woman with a wooden pizza board is near that.;NA;A person with a wooden pizza board is near a huge oven.;They are doing something here.
./coco-images/images/COCO_train2014_000000394151.jpg;394151;The woman is standing above the two packed suitcases.;The woman is standing above some packed suitcases.;The woman is standing here.;The woman is standing above this.;They are standing above the two packed suitcases.;The person is standing above the two packed suitcases.;They are doing something here.
./coco-images/images/COCO_train2014_000000096222.jpg;96222;A man standing in front of a cake on a table.;NA;A man standing in front of a cake there.;A man standing in front of that.;NA;A person standing in front of a cake on a table.;They are doing something here.
./coco-images/images/COCO_train2014_000000163939.jpg;163939;A tin cup of noodles in water sitting in front of a computer.;NA;A tin cup of noodles in water sitting here.;NA;NA;NA;They are doing something here.
./coco-images/images/COCO_train2014_000000122731.jpg;122731;A person with face make up and a multi color umbrella and jacket.;NA;NA;NA;NA;NA;They are doing something here.
./coco-images/images/COCO_train2014_000000324732.jpg;324732;A woman standing next to refrigerators holding a sign.;NA;A woman standing there holding a sign.;A woman standing next to refrigerators holding this.;NA;A person standing next to refrigerators holding a sign.;They are doing something here.
./coco-images/images/COCO_train2014_000000075299.jpg;75299;Two movers with their open moving van, which is parked on a city street.;Some movers with their open moving van, which is parked on a city street.;Two movers with their open moving van, which is parked there.;NA;NA;Two people with their open moving van, which is parked on a city street.;They are doing something here.
./coco-images/images/COCO_train2014_000000184930.jpg;184930;A man is carrying two extra large teddy bears.;A man is carrying some extra large teddy bears.;NA;A man is carrying that.;They are carrying two extra large teddy bears.;A person is carrying two extra large teddy bears.;They are doing something here.